{
  "schema_version": "0.1.1",
  "profile_id": "qual-nohook",
  "status": "reference-unvalidated",
  "identity": {
    "arch": "x86_64",
    "min_kernel": "7.0",
    "source": {
      "origin": "test",
      "revision": "7.0.0-test",
      "note": "config=sha256:a5af36b05630b51bb596bc68f955ab97bb8802e857cd2fc1de05c0628e398fbb config_src=gz btf=sha256:6c7ff9b36482a9d14bdf40c8947ee750d29bca4535797d97f7fa896be1c80233 format=sha256:43b8d6d56b37ff999c0b715373b2951f11e36d7daaa9db65ff524de99ed466dc object=sha256:da3eb1c12057b294ded5e27cb13ee32ff1d40e20ff312fa1431c9fb537ce7df4 image=sha256:11a663ae36f0cdbecf94b8b7319503bbd0fffc2c3ba02c01cf81600d423dd251 image_bid=0102030405060708090a0b0c0d0e0f1011121314 ring_bytes=8388608"
    },
    "note": "Qualify-fixture identity; never ship."
  },
  "hooks": [],
  "capabilities": [
    {
      "id": "attempt-trace",
      "status": "candidate",
      "hooks": [],
      "reason": "Qualify fixture."
    },
    {
      "id": "mapping-lifecycle",
      "status": "candidate",
      "hooks": [],
      "reason": "Qualify fixture."
    },
    {
      "id": "copy-actual",
      "status": "unsupported",
      "hooks": [],
      "reason": "Qualify fixture."
    }
  ],
  "notes": [
    "Qualify fixture; regenerated by tools/emit-qualify-fixtures."
  ]
}
