{
  "schema_version": "0.1.1",
  "profile_id": "scan-noted",
  "status": "reference-unvalidated",
  "identity": {
    "arch": "x86_64",
    "min_kernel": "7.0",
    "source": {
      "origin": "test",
      "revision": "7.0.0-test",
      "note": "config=sha256:a5af36b05630b51bb596bc68f955ab97bb8802e857cd2fc1de05c0628e398fbb config_src=gz btf=sha256:785b0751fc2c53dc14a4ce3d800e69ef9ce1009eb327ccf458afe09c242c26c9 format=sha256:43b8d6d56b37ff999c0b715373b2951f11e36d7daaa9db65ff524de99ed466dc object=sha256:da3eb1c12057b294ded5e27cb13ee32ff1d40e20ff312fa1431c9fb537ce7df4 image=sha256:11a663ae36f0cdbecf94b8b7319503bbd0fffc2c3ba02c01cf81600d423dd251 image_bid=0102030405060708090a0b0c0d0e0f1011121314 ring_bytes=8388608"
    },
    "note": "Scan-fixture identity; never ship."
  },
  "hooks": [
    {
      "name": "swiotlb:swiotlb_bounced",
      "kind": "tracepoint",
      "id_path": "/sys/kernel/tracing/events/swiotlb/swiotlb_bounced/id",
      "format_path": "/sys/kernel/tracing/events/swiotlb/swiotlb_bounced/format",
      "format_text": "name: swiotlb_bounced\nID: 1234\nformat:\n\tfield:unsigned short common_type;\toffset:0;\tsize:2;\tsigned:0;\n\tfield:unsigned char common_flags;\toffset:2;\tsize:1;\tsigned:0;\n\tfield:unsigned char common_preempt_count;\toffset:3;\tsize:1;\tsigned:0;\n\tfield:int common_pid;\toffset:4;\tsize:4;\tsigned:1;\n\n\tfield:__data_loc char[] dev_name;\toffset:8;\tsize:4;\tsigned:0;\n\tfield:u64 dma_mask;\toffset:16;\tsize:8;\tsigned:0;\n\tfield:dma_addr_t dev_addr;\toffset:24;\tsize:8;\tsigned:0;\n\tfield:size_t size;\toffset:32;\tsize:8;\tsigned:0;\n\tfield:bool force;\toffset:40;\tsize:1;\tsigned:0;\n\nprint fmt: \"dev_name: %s dma_mask=%llx dev_addr=%llx size=%zu %s\", __get_str(dev_name), REC->dma_mask, (unsigned long long)REC->dev_addr, REC->size, REC->force ? \"FORCE\" : \"NORMAL\"\n",
      "note": "Scan-fixture hook."
    }
  ],
  "capabilities": [
    {
      "id": "attempt-trace",
      "status": "candidate",
      "hooks": [
        "swiotlb:swiotlb_bounced"
      ],
      "reason": "Scan fixture."
    },
    {
      "id": "mapping-lifecycle",
      "status": "unsupported",
      "hooks": [],
      "reason": "Scan fixture."
    },
    {
      "id": "copy-actual",
      "status": "unsupported",
      "hooks": [],
      "reason": "Scan fixture."
    }
  ],
  "notes": [
    "Scan fixture; regenerated by tools/emit-scan-fixtures."
  ]
}
