{
  "schema_version": "0.1.1",
  "profile_id": "saturation-candidate",
  "status": "reference-unvalidated",
  "identity": {
    "arch": "x86_64",
    "min_kernel": "7.0.0",
    "source": {
      "origin": "distro",
      "revision": "7.0.0-34-generic",
      "note": "config=sha256:e75c0adab6020e72844d7431cf801a02b94ed32efc251c3b0fb80c021d065180 config_src=file btf=sha256:16205476ae9b6d621e056249052a5789d7f22c6a8c27bf291eb787f3bda5090e format=sha256:7e95fff18d1bd16c18342d821e78680a0126ff84054936fbc641e181810f0b62 object=sha256:f3d02f884a033b2350f1080433affe723482c09a01d784a750c9c1662324d42b image=sha256:7efd88a7facf80874d781ccb2c2421f0aaaa575e3b94760430619e826f490117 image_bid=165b9a4f9609ede635b85d0d1241ee95208e4548 ring_bytes=4096"
    },
    "note": "Narrow identity for the qualified gate kernel. The bindings name the exact config, BTF, tracepoint format, object, image, and build-id qualified by the live cross-check; any change fails admission until re-qualification."
  },
  "hooks": [
    {
      "name": "swiotlb:swiotlb_bounced",
      "kind": "tracepoint",
      "id_path": "/sys/kernel/tracing/events/swiotlb/swiotlb_bounced/id",
      "format_path": "/sys/kernel/tracing/events/swiotlb/swiotlb_bounced/format",
      "format_text": "name: swiotlb_bounced\nID: 382\nformat:\n\tfield:unsigned short common_type;\toffset:0;\tsize:2;\tsigned:0;\n\tfield:unsigned char common_flags;\toffset:2;\tsize:1;\tsigned:0;\n\tfield:unsigned char common_preempt_count;\toffset:3;\tsize:1;\tsigned:0;\n\tfield:int common_pid;\toffset:4;\tsize:4;\tsigned:1;\n\n\tfield:__data_loc char[] dev_name;\toffset:8;\tsize:4;\tsigned:0;\n\tfield:u64 dma_mask;\toffset:16;\tsize:8;\tsigned:0;\n\tfield:dma_addr_t dev_addr;\toffset:24;\tsize:8;\tsigned:0;\n\tfield:size_t size;\toffset:32;\tsize:8;\tsigned:0;\n\tfield:bool force;\toffset:40;\tsize:1;\tsigned:0;\n\nprint fmt: \"dev_name: %s dma_mask=%llx dev_addr=%llx size=%zu %s\", __get_str(dev_name), REC->dma_mask, (unsigned long long)REC->dev_addr, REC->size, REC->force ? \"FORCE\" : \"NORMAL\"\n",
      "note": "Exact tracepoint format bytes recorded during qualification; admission requires byte-equality."
    }
  ],
  "capabilities": [
    {
      "id": "attempt-trace",
      "status": "candidate",
      "hooks": [
        "swiotlb:swiotlb_bounced"
      ],
      "reason": "Supported on this exact kernel when the VM-gate live cross-check holds; the narrow bindings refuse every other identity."
    },
    {
      "id": "mapping-lifecycle",
      "status": "unsupported",
      "hooks": [],
      "reason": "No validated lifecycle mechanism exists."
    },
    {
      "id": "copy-actual",
      "status": "unsupported",
      "hooks": [],
      "reason": "No validated executed-length source exists."
    }
  ],
  "notes": [
    "Generated by tools/emit-gate-profiles from dumped guest identity.",
    "Distro patch set, kernel config, and BTF build are pinned by hash in the narrow bindings."
  ]
}
