{
  "schema_version": "0.1.1",
  "profile_id": "scan-notext",
  "status": "validated",
  "identity": {
    "arch": "x86_64",
    "min_kernel": "7.0",
    "source": {
      "origin": "test",
      "revision": "7.0.0-test",
      "note": "config=sha256:a5af36b05630b51bb596bc68f955ab97bb8802e857cd2fc1de05c0628e398fbb config_src=gz btf=sha256:785b0751fc2c53dc14a4ce3d800e69ef9ce1009eb327ccf458afe09c242c26c9 format=sha256:43b8d6d56b37ff999c0b715373b2951f11e36d7daaa9db65ff524de99ed466dc object=sha256:dbf15c855039a80fb1b4a3f015249c456bebeba4ec889db0ed0fe1f53d8aa3ce image=sha256:11a663ae36f0cdbecf94b8b7319503bbd0fffc2c3ba02c01cf81600d423dd251 image_bid=0102030405060708090a0b0c0d0e0f1011121314 ring_bytes=8388608"
    },
    "note": "Scan-fixture identity; never ship."
  },
  "hooks": [
    {
      "name": "swiotlb:swiotlb_bounced",
      "kind": "tracepoint",
      "id_path": "/sys/kernel/tracing/events/swiotlb/swiotlb_bounced/id",
      "format_path": "/sys/kernel/tracing/events/swiotlb/swiotlb_bounced/format",
      "format_text": null,
      "note": "Scan-fixture hook."
    }
  ],
  "capabilities": [
    {
      "id": "attempt-trace",
      "status": "supported",
      "hooks": [
        "swiotlb:swiotlb_bounced"
      ],
      "reason": "Scan fixture."
    },
    {
      "id": "mapping-lifecycle",
      "status": "unsupported",
      "hooks": [],
      "reason": "Scan fixture."
    },
    {
      "id": "copy-actual",
      "status": "unsupported",
      "hooks": [],
      "reason": "Scan fixture."
    }
  ],
  "notes": [
    "Scan fixture; regenerated by tools/emit-scan-fixtures."
  ]
}
