{
  "schema_version": "0.1.1",
  "profile_id": "test-validated",
  "status": "validated",
  "identity": {
    "arch": "x86_64",
    "min_kernel": "7.0",
    "source": {
      "origin": "test",
      "revision": "7.0.0-34-generic",
      "note": "config=sha256:a5af36b05630b51bb596bc68f955ab97bb8802e857cd2fc1de05c0628e398fbb config_src=file btf=sha256:cdf977541b65207b9a19ebcdac8cc70f2a246aaae23b4253d04e0514ab1d0e68 format=sha256:17eb9bf8e3e65489f32ae871bd5d84679800df6b971dd711f98ff7d2296af2f8 object=sha256:7549adfdf9837cefd566373a0efeee8550abdb4cd678b6fa15fe11f3f4785a37 image=sha256:11a663ae36f0cdbecf94b8b7319503bbd0fffc2c3ba02c01cf81600d423dd251 image_bid=0102030405060708090a0b0c0d0e0f1011121314 ring_bytes=8388608"
    },
    "note": "Test-only profile for signature-match coverage. Never ship in profiles/."
  },
  "hooks": [
    {
      "name": "swiotlb:swiotlb_bounced",
      "kind": "tracepoint",
      "id_path": "/sys/kernel/tracing/events/swiotlb/swiotlb_bounced/id",
      "format_path": "/sys/kernel/tracing/events/swiotlb/swiotlb_bounced/format",
      "format_text": "name: swiotlb_bounced\nID: 1901\nformat:\n\tfield:unsigned int test_field;\toffset:0;\tsize:4;\tsigned:0;\n\nprint fmt: \"test_field=%u\", REC->test_field\n",
      "note": "Recorded format is byte-identical to the ready-validated fixture file."
    }
  ],
  "capabilities": [
    {
      "id": "attempt-trace",
      "status": "supported",
      "hooks": [
        "swiotlb:swiotlb_bounced"
      ],
      "reason": "Test support declaration for the ready path."
    },
    {
      "id": "mapping-lifecycle",
      "status": "unsupported",
      "hooks": [],
      "reason": "No validated lifecycle mechanism exists in this profile."
    },
    {
      "id": "copy-actual",
      "status": "unsupported",
      "hooks": [],
      "reason": "No validated executed-length source exists in this profile."
    }
  ],
  "notes": [
    "Test-only. Not admitted by profiles/manifest.txt."
  ]
}